<?xml version="1.0" encoding="UTF-8"?>
<?xml-stylesheet type="text/xsl" href="unadjusted-actor-weights.xslt"?>
<unadjusted-actor-weights xmlns:xsi="http://www.w3.org/2001/XMLSchema-instance" xsi:noNamespaceSchemaLocation="unadjusted-actor-weights.xsd">
<actor-weight>
		<type>Simple</type>
		<description>The Actor represents another system with a defined API.</description>
		<weight>1</weight>
		<num-actors>0</num-actors>
		<result>0</result>
	</actor-weight>
	<actor-weight>
		<type>Average</type>
		<description>The Actor represents another system interacting through a protocol, like TCP/IP.</description>
		<weight>2</weight>
		<num-actors>0</num-actors>
		<result>0</result>
	</actor-weight>
	<actor-weight>
		<type>Complex</type>
		<description>The Actor is a person interacting via an interface.</description>
		<weight>3</weight>
		<num-actors>0</num-actors>
		<result>0</result>
	</actor-weight>
	<total-UAW>0</total-UAW>
</unadjusted-actor-weights>